Song Name,Lyrics
Talk To Me,"I don't know if what we have is love, but it's on my mind
We might slide on a nigga inside this club, girl, close your eyes
15 brothers, no friends when I pull up, for peace of mind
Lights come on, I'ma need you to come find me, don't be so shy
'Cause I know you want me, girl
'Cause I know you want me, girl
'Cause I know you want me, girl
'Cause I know you want me
Want me, girl (I know you want me)
'Cause I know you want me (shit)
'Cause I know you want me, girl (they all want me)
Don't be shy, I got killers with me, stupid
I march with sticks, I ain't worried 'bout no groupies
I know you want me 'cause your BD is a goofy
Boss you up, your lifestyle could be exclusive
But I don't know, 'cause you be hangin' 'round with losers
Internet trolls and niggas tryna do me
650S, bitch, I feel like Lil Boosie
You want me, so do all your friends, is you stupid?
Stop complaining to me, I am not the one you love
Ain't comin' over late night, don't want no shoulder rubs
In the trenches every night, bitch, I'm holdin' guns
Hold me down or could you slow me down?
I'm a dog 'cause you really know me now?
On black and white just 'cause I'm gettin' holy now?
Another reason I'ma have to slow it down
Snakes in the grass, you know I had to blow 'em down
We at the club, all my niggas down to slide
Look for the bright lights, I ain't really hard to find
We at the club, all my niggas down to slide
Look for the bright lights, I ain't really hard to find, the Ruler
I don't know if what we have is love, but it's on my mind
We might slide on a nigga inside this club, girl, close your eyes
15 brothers, no friends when I pull up, for peace of mind
Lights come on, I'ma need you to come find me, don't be so shy
'Cause I know you want me, girl
'Cause I know you want me, girl
'Cause I know you want me, girl
'Cause I know you want me
Want me, girl
'Cause I know you want me
'Cause I know you want me, girl
I know you want me, I know you love me
You can't control me, why you acting like the police?
Pussy ain't that good to keep me from my homies
We just cool, bro, you gettin' too excited
Ain't seen your face when I was up on that indictment
Ain't get a letter, I was strugglin' and fightin'
With these peoples, they was demons
Tried to put me in a cage, was sayin', ""Free me""
Now we on TV, drag racin' at 8A
Rugrats in the car, we was Bébés
Ayy, baby, was your name on any JPays?
Got the audacity to talk to me crazy, you buggin'
I don't know if what we have is love, but it's on my mind
We might slide on a nigga inside this club, girl, close your eyes
15 brothers, no friends when I pull up, for peace of mind
Lights come on, I'ma need you to come find me, don't be so shy
'Cause I know you want me, girl
'Cause I know you want me, girl
'Cause I know you want me, girl
'Cause I know you want me
Want me, girl
'Cause I know you want me
'Cause I know you want me, girl"
You’re Mines Still (feat. Drake),"So you wanna be riding around with your new bitch
That's real cute
Don't have me drag you and her out that motherfuckin' car
Key your shit
Aha! I wish I would see you in that Bentley
So I could flat all four of your motherfuckin' tires
And you know what? I just got tickets to the Lakers game anyway
Nigga, you could never
If I ever made you angry, girl
Just know that it get better over time (time)
They say time heals (they say time heals)
She can't see her life without me, she so blessed still (so blessed still)
Fuck that nigga, you can tell him that you're mine still (that you're mine still)
And she don't wanna go to sleep she angry
Latеly she been noticing he ain't me
I wish that wе can change places
Don't want no new, new faces
She got my heartbeat racing
They say time heals (they say time heals)
Don't go build no life without me 'cause you're mine still (you're mine still)
Oh, and I don't wanna go unless you make me
Lately I've been gone, I'm feeling crazy
Yeah, I'm from the bricks, we gotta whole lot of bricks
You gotta whole lotta tricks and I wanna see what you do with them
I just saw you in Miami, girl, what you doing here? (What you doing here?)
I hope you with your girlfriends (girlfriends)
I ain't pay attention to your heart, I played ya
Now she fell in love with an NBA player
Had her on the stage, now she ballin' at the stadium
Matter fact I hope you stay with him
'Cause I don't wanna go unless you take me
I know you feel the pain
And she don't wanna go to sleep she angry
Lately she been noticing he ain't me
I wish that we can change places
Don't want no new, new faces
She got my heartbeat racing
They say time heals (they say time heals)
Don't go build no life without me 'cause you're mine still (you're mine still)
And I don't wanna go unless you make me
Down on my knees hoping you take me
Better tell that nigga you mine
Heard you've been trying to tie the knot, girl, tell me you lyin'
Let me beat that pussy up one more time
Let me beat that pussy up one more time
I know that you feen for this
I know that you did not forget
So don't go to sleep
And she don't wanna go to sleep she angry
Lately she been noticing he ain't me
I wish that we can change places
Don't want no new, new faces
She got my heartbeat racing
They say time heals (they say time heals)
Don't go build no life without me 'cause you're mine still (you're mine still)
Oh, and I don't wanna go unless you make me
Lately I've been gone, I'm feeling crazy"
Race My Mind,"Just hung up the phone and I
Could already tell that you're comin' home intoxicated, ooh
So you better take your time with me
'Cause I remember last time you wouldn't make love to me
Then you fell fast asleep (I hope you niggas sleep)
Wouldn't even talk to me, no
Say, say I'm so crazy, baby (I'm so crazy)
I wanted you to race my mind, I got the keys
Please, for me
Since you're comin' home intoxicated, oh
For me, please
I wanted you to race my mind, mind
They said you got high as the sky
Up all night just dancing, huh
I hit you like, ""Please come home to me"" (come home to me)
But you're not understanding, no
You gon' make me beg, make me plead (plead)
I wanted you to race my mind, I got the keys
I just figured you could make time for me
Since that you're comin' home intoxicated, oh, yeah
Race, race my mind
I got the keys
Picture me rollin' through downtown in the A4
Picture my signature on a pair of some J4s
Picture me carin' what niggas sayin' on Wi-Fi they don't pay for
Knew I needed love but I think I value the hate more
To push towards things that I prayed for
Retrograde energy shifts are what I was made for
And don't you dare hit me back with no, ""K, sure""
Soon as I tell you that you the one I will wait for
You too saucy, too flossy
You moved in then moved off me
All to be with niggas who just startin' to move bossy
Maybe I just handled you too softly
Them boys got no Kelis in they blood
If your whole heart wasn't in it, I know a piece of it was
Posted that pic you sent me, it wasn't recent enough
How I'm supposed to wife it? You not Ayesha enough
You love gettin' T-d up, love showin' the cakes
You know that they eat it up
Love touchin' the road as soon as it's heatin' up
Invited you over, you said that you showin' up
All them spellin' mistakes, I know that you drunk as fuck
All them other mistakes, let's let it be what it was
(Them niggas just can't understand it)
I want you to change my mind, I'm prayin' you pullin' up
Know who you bein' 'round, I know that they teamin' up
Tellin' you you better off leavin' me in the dust
I wanted you to race my mind
I got the keys
Please, for me
Since you're comin' home intoxicated, oh
For me, please
I wanted you to race my mind, mind
Please, please, please
Since you're comin' home intoxicated, oh
For me, please"
Circo Loco,"I've been blowin' through the money like it grow on trees
I've been fuckin' on a French bitch, c'est la vie
I just put 'em on a jet, now they all Italian
Way I'm dressin', tell I've been to a thousand islands
This bitch lie 'bout gettin shots but she still a stallion
She don't even get the joke but she still smilin'
Every night, late night like I'm Jimmy Fallon
Crod' shoot from anywhere like he Ray Allen
Crody turn me up
Crody turn me up
Crody turn me up
Got a fur on a temp but got me burning up
Shorty say she graduated, she ain't learn enough
Play the album track one, 'kay I heard enough
Girl, the driver downstairs, better hurry up
Savage got a new stick, he wanna dirt it up
Touchdown in N.Y., turn the Mercer up
Ayy, Bottega shades with the grey tints
Introduce me to a nigga, yeah it make sense
Gotta put her on the team, got a grey Benz
Linking with the opps, bitch I did that shit for J Prince
Bitch I did it for the mob ties
Feel like seventeen, two percs, frog eyes
And I never been the one to go apologize
Me, I'd rather hit 'em up one more time
Ayy, known a girl for six months, dinner up at my place
But I got these diamonds on my neck so it's a blind date
All my niggas on the roads raising up the crime rate
Your name not ringin' out here, its on vibrate
And she took a score now shorty gotta hydrate
And he did some dirt now my crodie gotta migrate
Prolly won't see him for some years, when I do though, turn me up
Crody turn me up
Crody turn me up
Ayy, Crodie, turn me
Ayy, yeah, what? Crodie turn me (what)
21, in a droptop Benz like it's '03
21, had the shooters aim down from the nosebleeds
21, gotta get this passport, keep my nose clean
Bitch tried to burn me up, keep a magnum tucked (yeah)
I'a never slip (never)
SF90 rims red like a poker chip (pussy)
Rich as hell, still hood, in the stroker's ville (pussy)
Pink slip in the glove for the ownership (21)
Limping with the thirty on like a broke hip (21)
Red flag giving blood on some donor shit (on god)
All the opps get a bullet on some Oprah shit
Went from Angel Town estates to a bigger state
Prolly woulda had a zombie on me if I woulda stayed (21)
Still'a caught a case if I woulda stayed (facts)
I been thugging all my life, that's just how I play it (facts)
Still posted in the A' where niggas feel me (facts)
Still gotta see the Gunners win the Premier League (facts)
Still gotta keep a gun that's always near me and I'm down to hit em up
One more time (21), hit my line, you know that head was great
Oh, yeah, alright, don't do romancing
One more time, you gotta run the face
Oh, yeah, alright
One more time"
No Friends In The Industry,"No friends in the industry
My brothers been my brothers, man
You niggas ain't no kin to me, a fact (whoa)
Yeah, you heard about me, you don't know me more than that
Yeah, I know, I
Hey, hey, yeah
No friends in the industry
My brothers been my brothers, man
You niggas ain't no kin to me, a fact (whoa)
I was known for snappin' when I chat before the app
Stood on everything I said and never took it back (whoa)
No friends in the industry
I had to draw the line between my brothers and my enemies, a fact
Niggas love to start the beef, don't wanna keep it rap
Yeah, you hit us up and now we owe you something back
See, when I was young angel but these niggas turned me evil
Yeah, I know I know you, but you really ain't my people
Yeah, I heard some people say they know 'em as my equal
Truth be told, I son these niggas, girl, I don't compete with 'em
Ask about The Boy and they gon' say they got the streets with him
Niggas so offensive knowin' they don't have no defense
Why they always act like we can fix it with a meeting?
All that linking up, man, I'ma see ya when I see ya
Yeah
Yeah
Yeah, brothers been my brothers, man
You niggas ain't no kin and that's a fact (ayy)
And I'm like Sha'Carri, smoke 'em on and off the track (ayy)
And you love that ho, but me, I put her on her back
You get Drizzy on a track, he'll put you on the map
Oh, it's like that? Hell yeah it's like that (ayy)
And I got a contract, it's a max (ayy)
Since I got in contact, she attached
When I signed my first deal, that shit came through a fax
That should let you know how long I been out here runnin' laps
(I been doin' this for a long time)
Yeah, no friends in the industry
My brothers been my brothers, man
You niggas ain't no kin to me, a fact (whoa)
I was known for snappin' when I chat before the app
Stood on everything I said and never took it back (whoa)
No friends in the industry
I had to draw the line between my brothers and my enemies, a fact
Niggas love to start the beef, don't wanna keep it rap
Yeah, you hit us up and now we owe you something back
Damn, this shit too dirty, gotta yellow tape it
And I got her waitin' at the telly naked
We ain't drop though, how you niggas celebratin'?
Already disrespecting, something I ain't tolerating
You niggas fuck with me, I give 'em motivation
And your circle shrinkin', see some boys escapin'
Rest of them is guilty by association (ayy, what?)
Fuck debatin' who the G.O.A.T.
Better not make the shit up 'bout the numbers all I know
Better not make the shit up 'bout the summer all I know
Better find you someone else to hit with all that smoke, nigga, yeah
And all them tweets and all them posts
Ain't got the type of time to be playin' with you folk
I had a Richard prior to these niggas, that's the joke
I'm really down to die behind these verses in my notes
Yeah
Yeah
Yeah, brothers been my brothers, man
You niggas ain't no kin and that's a
(I could play off the iPod?
Yeah 'cause this a motherfuckin' 2016, baby
I see the way the lights go, on the dashboard
The lights go to the dashboard
That's how you know it's new, ooh)"
POPSTAR (feat. Drake),"Bitches
We The Best Music
Another one, yeah
DJ Khaled
Bitches callin' my phone like I'm locked up, nonstop
From the plane to the fuckin' helicopter, yeah
Cops pullin' up like I'm givin' drugs out, nah, nah
I'm a popstar, not a doctor
Bitches callin' my phone like I'm locked up, nonstop
From the plane to the fuckin' helicopter, yeah
Cops pullin' up like I'm givin' drugs out, nah, nah
I'm a popstar, not a doctor
Ayy, shawty with the long text, I don't talk, ayy
Shawty with the long legs, she don't walk, ayy
Yeah, last year, I kept it on the tuck, ayy
2020, I came to fuck it up, yeah
I want a long life, a legendary one (yeah)
I want a quick death (yeah), and a easy one (yeah)
I want a pretty girl (yeah), and a honest one (yeah)
I want this drink (yeah), and another one, yeah
And I'm troublesome, yeah
I'm a popstar, but this shit ain't bubblegum, yeah
You would probably think my manager is Scooter Braun, yeah
But my manager with twenty hoes in Buddakan, yeah, ayy
Look, Ariana, Selena, my Visa
It can take as many charges as it needs to, my girl
That shit platinum just like all of my releases, my girl
Niggas come for me, I tear them all to pieces, my girl
I'ma show your sexy ass what relief is, my girl
Please don't take no shit that's 'bout to have you geekin'
And I'm not drivin' nothin' that I gotta stick the keys in
Wonder how I got this way? I swear I got the
Bitches callin' my phone like I'm locked up, nonstop
From the plane to the fuckin' helicopter, yeah
Cops pullin' up like I'm givin' drugs out, nah, nah
I'm a popstar, not a doctor
Bitches callin' my phone like I'm locked up, nonstop
From the plane to the fuckin' helicopter, yeah
Cops pullin' up like I'm givin' drugs out, nah, nah
I'm a popstar, not a doctor
I'm a popstar, not a doctor, watch her
Say she rep a whole different block, so I blocked her
Busy at the crib, cookin' salmon with the lobster
If we talkin' joints, it's just me and David Foster
Bodyguards don't look like Kevin Costner, you tweakin'
Just pulled up to Whitney Houston, Texas for the evenin'
They tell the same story so much, they start to believe it
The ones that start like, ""Drizzy's shit was cool, but we even""
Man, how the fuck?
Two, four, six, eight watches, factory, so they appreciate
Crown in my hand and I'm really playin' keep-away
Shit don't even usually get this big without a Bieber face
Nah, nah, piece of cake, nah, nah, Turks and Caic', yeah, yeah
Go and get your friends, we can sneak away, yeah, yeah
Yeah, I keep a, like I keep the faith
Wonder how I got this way? Swear I got the
Bitches callin' my phone like I'm locked up, nonstop
From the plane to the fuckin' helicopter, yeah
Cops pullin' up like I'm givin' drugs out, nah, nah
I'm a popstar, not a doctor
Bitches callin' my phone like I'm locked up, nonstop
From the plane to the fuckin' helicopter, yeah
Cops pullin' up like I'm givin' drugs out, nah, nah
I'm a popstar, not a doctor"
Currents,"Don't think twice
We're still in formation
Testing the current
Already I'm sailing, it's all so sudden
Catching a flight
You think we're moving too fast, I'm
Intoxicated
We can move in slow motion if that's what you want, babe
I don't want to come on too strong
But I'm moving to your room now
With every move, with every move you make, babe
I'm tumbling
In your own time
Would you show me something please, babe?
Don't wanna wait in vain
You're the missing piece I, I been longing for
Don't deny, oh no
The temperature's rising inside
The cracks are showing
Show me all your colors, I may not deserve you
I don't want to come on too strong
But I'm moving to your room now
With every move, with every move you make, babe
I'm tumbling"
Pussy & Millions (feat. Travis Scott),"I been out, late night creepin', should I slide on bitches?
Posted up with the militia
Niggas ain't switchin', mind on missions
Mind on pussy and millions, mind on pussy and millions
I'm tryna call a sex symbol to eat my kids up
They say more money, more problems (Will)
Bring on the problems (Will)
Bring on the problems (Will)
Bring on the motherfuckin' problems
They say more money, more problems
Bring on the problems
Bring on the problems
Bring on the motherfuckin' problems, ayy
Braided up in Matsuhisa
Hit 'em then I get amnesia
Life ain't gettin' any easier
Flaca, Flacasita
I know that I'm not in love, she don't love me either
It's just hard to find the love, this shit keep on gettin' deeper
Who said it's cheaper to keep her?
I'd rather release her
Body ain't give her the wave like a feature
You know the procedure
Niggas is praying to God so we stay with the sweeper
I'm reppin' 4L with my twinny, so treacherous introduce y'all to the leader
Come to me with all the smoke
I like the money, for sure
But I love the hustle the most
She pretty, she show off her toes
And my Pateks, they came with a pole
Know this money bring envy and jealousy
I'm like, ""Fuck it, I want me some more""
Hit it from the back, she bent up
Playin' with the money, get spent up
Chains on my neck, no Kente
You the type of girl I pay rent for
Suck it in the car, that's what the tint for
Bought me a plane, not a Sprinter
Quarter-million dollars on her dental
She say I'm a stepper, but gentle
I been out, late night creepin', should I slide on bitches?
Posted up with the militia
Niggas ain't switchin', mind on missions
Mind on pussy and millions, mind on pussy and millions
I'm tryna call a sex symbol to eat my kids up
They say more money, more problems (Will)
Bring on the problems (Will)
Bring on the problems (Will)
Bring on the motherfuckin' problems
They say more money, more problems
Bring on the problems
Bring on the problems
Bring on the motherfuckin'
Only signin' the gang
We the new Lucian Grainge
Bring on the rings (yeah)
Her MJ thing, I'm talkin' a Brady thing
I'm off of the juice, never Canseco the mix
Rockin' the braids, not the twists
Full puff, he can't comb
Not actin' like Christians in here
But Christian Dior in they homes, the bigger we get
Gotta thank God for this, I got a lot that I give
I be handin' out gifts like the Christmas on twenty-fifth
Out in the twenties inside of the twenty and
Said I would buy the jet 'fore I could 'fford this shit
Now I got the jet, building the landing strip
In the back of the crib, I record the hits
In the front of the crib they valet the whips
(How many whips I need? Let's go)
Breakin', breakin' the records, more money, more problems
They come with the status
Runnin' through customs when you run the atlas
I got accustomed, accustomed the fastest
I'm talkin' 'bout fabrics, I'm talkin' 'bout mattress
I never sleep, though I sleep with a baddie
I'm movin' deep 'cause that's just how it's happenin'
If you come out, just be ready for action (La Flame)
Just needed some time
I settled my time, now they see the signs
You didn't leave me solo, right here, all alone
You held it down for me, right on my own
Young nigga get it, just try to get home
I got a rolodex all in my phone and it's still wrong
I been out, late night creepin', should I slide on bitches?
Posted outside with militia
Niggas ain't switchin', mind on mission
Mind on pussy and billions, mind on pussy and billions
You know I got a sex symbol, that eat my kids, uh
They say more money, more problems
Bring on the problems
Bring on the problems
Bring on the motherfuckin' problems
They say more money, more problems
Bring on the problems
Bring on the problems
Bring on the motherfuckin'"
Papi’s Home,"Yeah
(I was a child trying to be a man)
To all my sons worldwide
(I walked out on my only son)
All my juniors
(I left you in your mother's hands)
I apologize for my absence, I know I left you without a name to drop
(And now I'm standing right here)
I don't know how I expected you to get your clout up and get your money up, but
(With tears, with tears streaming from my eyes)
Don't worry
(See your mother raised a fine young man)
Daddy's home
(And I know I missed so much of your life)
Turn me up (Mario)
Yeah
Niggas know they need to stop
I'm standing at the top, that's how I know you never seen the top
Sierra Canyon parking lot lookin' like Magic City parking lot
Hear the talks when I walk by like you know it's over when we drop
Ayy, drop
Yeah, and I'm coming with the wop
Y'all niggas not poppin'
Fuck her, then she goin' shoppin'
Whoa, I'm runnin' out of opps
They're runnin' out of options
Put 'em up for adoption
Sign my name on the dot
Ayy, this is not luck, baby, this no four-leaf, no horseshoe
I'm in the bank thinkin', ""Poor you""
I'm in New York goin' Jon Chetrit
Supermodels and they all sexy
Lock the door to the bathroom 'cause they doin' something that is not Pepsi
I'm just pourin' up the shots
I remember that I told you I miss you, that was kinda like a mass text
I remember that I told I loved you, that was really in the past tense
I remember that I told you I get your true fears, that I get around
Mentioned havin' us a kid, 42 hit, I tend to kid around
Yeah, on Benedict with the top down
Shorties out here gettin' knocked down
City coming off a lockdown
Rap niggas doing weak features for a pop artist 'cause they popped down
Used to wanna throw the Roc up, niggas know how I rock now
You know how I'm rocking now
YM forever
Big owl, big birds forever
Don't make me go get your mama to talk to you
'Cause if he gotta get your motherfuckin' mama to talk to you
You know what I'm sayin', I'ma bring that motherfuckin' big switch out
At this point, I'ma start collectin' child support the opposite way
You gotta pay me to keep my motherfuckin' son, hahahaha
Look at me
(Take a real good look at me)
Don't turn away
(Don't you turn away like I did my son)
Look me in the eyes, junior
(I'm making no more promises)
For real
I'm trying to find the word to say
Daddy's home
Daddy's home (don't you know)
Daddy's home (said, your daddy's back home)
Yeah
Daddy's home (for every birthday that I missed)
Wanna be my dad again
We've got to start all over, be friends (start right here, right now)
If you wanna be my dad again (said, my only son)
We've got to start all over, be friends (can you look at me?)
Yeah, baby
Yeah, baby, that's it
Showtime
Something's happened to me, bro
Hahaha"
