Song Name,Lyrics
Gold Roses (feat. Drake),"Yeah
I'm home now, it's over now, so...
Yeah
She got a thing for Chanel vintage
That dropped before she could speak English
Do you love me or love seekin' attention, I mean which one is it?
You keep callin' me ya twin, but twins ain't this different
Mentally I'm already on next year, that's some 20-20 clear vision
You sayin' let you finish, I ain't tryna hear it
I'm all for spiritual liftin', but I don't fly Spirit
I'm all for findin' happiness, but down to die serious
All smiles, Kevin Durant trials
Had to blow it on the court, I must have blew a milli'
I'm walkin' on all charges, that's my new Achilles
I know they love to rock a check, but who gon' do it really? Really?
My depositions never surface
Tanenbaum know the logo on the jersey, it's gettin' purchased
Ten years in and y'all yet to hear my most impressive verses
Paid the cost to be the boss wasn't even my most expensive purchase
Trust when I say I'm never on the shit they assumin' I'm on
Tales about me are like corridos in Culiacán
Sashimi from Saito, you know that man two Michelin Star
Postcard from Grace Bay, sendin' my distant regards
Vision wasn't mine, told my niggas the vision was ours
Still a part of shorty even if we've been livin' apart
Roxx'll do you filthy for me soon as I give him the nod
Meanin' he'll blast for me like puttin' the 6 with the God
Hop on a float to show the city the one they appointed
The one that's rebuildin' schools and feedin' the homeless
Hang with my niggas, but sometimes I be tryna avoid it
'Cause they'll get to poppin' out of place like they double jointed
Goals was the top of the pyramid in this shitty world
""I gotta get the most of everything""
Is the axis on which it sit and twirls
Point blank period, like a City Girl and then I bring it back to 50 world
Ayy, woah
You made me this way, yeah
Before I'm gone outta this place, yeah
Put some flowers in my face, won't you?
Let me know that I did okay, yeah
Don't wait 'til some other day, no, no
They love to wait 'til it's too late, it's too late
(This different right here, yo)
I was nominated, never won a Grammy
But I understand, they'll never understand me
Lot of lives lost, but I never panicked
Lot of lines crossed, I never did a Xanny
A hundred room mansion but I felt abandoned
Love makin' love, but where will love land me?
Jealous, so their bitches be actin' like they sleepin' on us
But they speakin' on us, jewelers quote us even numbers
Still blowin' smoke as angels float above us
Love givin' back, but will they ever love us?
Chanel in the mail, FedEx from Pharrell
And what I got for sale just sit on the scale
Triple beam dream, a buck on the shades
I really seen things give mothers the shakes
I really bought cars for women on face
I know it seem odd, but money amazin'
College loans really did fuck up her credit
Discover cards, look back, I know she regret it
But we keep pushin', keep our foot on the pedal
In the mirror she a blessin', rebukin' the devil
Livin' on the edge, she keepin' me level
Money come and go, I'ma keep you forever
Money come and go, I'ma keep you forever (forever)
Slip-on glass slippers and tickle with feathers
Everywhere we go, we create a dilemma
Coming to America, really the set
I'll let your soul glow, I'm keepin' you wet
All my cold Decembers, I know she remembers
Forgiveness for a sinner, but is it that simple?
Holdin' on your hands, your body's a temple
Fly you out to Cannes, ménages with bitches
Lobsters and the prawns, thought you was Spanish
Bottles for the Don, our parties the biggest (biggest, biggest)
(Maybach Music)
Ayy, woah
You made me this way, yeah
Before I'm gone outta this place, yeah
Put some flowers in my face, won't you?
Let me know that I did okay, yeah
Don't wait 'til some other day, no, no
They love to wait 'til it's too late, too late (Ayy)
Had a dream she was singin' to me like Gladys Knight
True love in the projects is called paradise
All your niggas left, you wasn't actin' right
But honesty itself a small sacrifice
My money bag heavy, got me packin' light
You movin' funny, can you fill my appetite?
Niggas conversations, a lot of it false
He own condos right over Carnegie Hall
Speak about your cars, but all of 'em parked
Your niggas' money light, come out of the dark
You really are my type, that's not a facade
One of the reasons why I write, we got a synopsis
I'm always at the top of barbershop gossip
After further thought, better not knock 'em
Allocate some dollars to go out shoppin'
Bitch, we on the real, it's time to stop talkin' (stop talkin', stop talkin')
Ayy, woah
You made me this way, yeah
Before I'm gone outta this place, yeah
Put some flowers in my face, won't you?
Let me know that I did okay, yeah
Don't wait 'til some other day, no, no
They love to wait 'til it's too late, too late (Ayy)"
Passionfruit,"Hold on, hold on, fuck that
Fuck that shit
Hold on, I got to start this motherfuckin' record over again
Wait a minute
Fuck that shit
Still on this motherfuckin' record
I'ma play this motherfucka for y'all
Ayy, y'all get some more drinks goin' on
I'll sound a whole lot better
Listen
Seeing you got ritualistic
Cleansin' my soul of addiction for now
'Cause I'm fallin' apart
Yeah, tension
Between us just like picket fences
You got issues that I won't mention for now
'Cause we're fallin' apart
Passionate from miles away
Passive with the things you say
Passin' up on my old ways
I can't blame you, no, no
Passionate from miles away
Passive with the things you say
Passin' up on my old ways
I can't blame you, no, no
Listen
Harder buildin' trust from a distance
I think we should rule out commitment for now
'Cause we're fallin' apart
Leavin'
You're just doing that to get even
Don't pick up the pieces, just leave it for now
They keep fallin' apart
Passionate from miles away
Passive with the things you say
Passin' up on my old ways
I can't blame you, no, no
Passionate from miles away
Passive with the things you say
Passin' up on my old ways
I can't blame you, no, no
Um, trying to think of the right thing to say"
One Dance,"Baby, I like your style
Grips on your waist
Front way, back way
You know that I don't play
Streets not safe
But I never run away
Even when I'm away
Oti, oti, there's never much love when we go OT
I pray to make it back in one piece
I pray, I pray
That's why I need a one dance
Got a Hennessy in my hand
One more time 'fore I go
Higher powers taking a hold on me
I need a one dance
Got a Hennessy in my hand
One more time 'fore I go
Higher powers taking a hold on me
Baby, I like your style
Strength and guidance
All that I'm wishin' for my friends
Nobody makes it from my ends
I had to bust up the silence
You know you gotta stick by me
Soon as you see the text, reply me
I don't wanna spend time fighting
We've got no time
And that's why I need a one dance
Got a Hennessy in my hand
One more time 'fore I go
Higher powers taking a hold on me
I need a one dance
Got a Hennessy in my hand
One more time 'fore I go
Higher powers taking a hold on me
Got a pretty girl and she love me long time
Wine it, wine it, and she love me long time
Ooh yeah, very long time
Back up, back up, back up and wine it
Back up, back up and wine it
Girl, just back up, back up, back up and wine it
Ooh yeah, very long time
Back, up, back up and wine it, girl
Ooh, tell me
I need to know, where do you wanna go?
'Cause if you're down, I'll take it slow
Make you lose control
Where, where, where
Where, where, where, where (ooh yeah, very long time)
(Back, up, back up and wine it, girl)
'Cause if you're down (back up, back up and)
'Cause if you're down (back up, back up and)
'Cause if you're down (back up, back up and)
I need a one dance
Got a Hennessy in my hand
One more time 'fore I go
Higher powers taking a hold on me
I need a one dance
Got a Hennessy in my hand
One more time 'fore I go
Higher powers taking a hold on me"
Nice For What,"I wanna know who mothafuckin' representin' in here tonight
Hold on, hold on
I keep lettin' you back in (You back in)
How can I, explain myself?
Care for me, care for me, you said you'd care for me
There for me, there for me, said you'd be there for me
(Lil Weezyana shit)
Cry for me, cry for me, you said you'd die for me
(Murda on the beat)
Give to me, give to me, why won't you live for me?
Care for me, care for me, I know you care for me
(A song for y'all to cut up to, you know?)
There for me, there for me, said you'd be there for me (Yeah)
Cry for me, cry for me, you said you'd die for me
Give to me, give to me, why won't you live for me?
Everybody get your mothafuckin' roll on
I know shorty and she doesn't want no slow song
Had a man last year, life goes on
Haven't let that thing loose, girl, in so long
You've been inside, know you like to lay low
I've been peepin' what you bringin' to the table
Workin' hard, girl, everything paid for
First-last, phone bill, car note, cable
With your phone out, gotta hit them angles
With your phone out, snappin' like you Fabo
And you showin' off, but it's alright
And you showin' off, but it's alright (Alright!)
It's a short life, yeah
Care for me, care for me, you said you'd care for me
There for me, there for me, said you'd be there for me
Cry for me, cry for me, you said you'd die for me
Give to me, give to me, why won't you live for me?
That's a real one in your reflection
Without a follow, without a mention
You really pipin' up on these niggas
You gotta be nice for what to these niggas?
I understand, you got a hunnid bands
You got a baby Benz, you got some bad friends
High school pics, you was even bad then
You ain't stressin' off no lover in the past tense
You already had them
Work at 8 a.m., finish 'round five
Hoes talk down, you don't see 'em outside
Yeah, they don't really be the same offline
You know dark days, you know hard times
Doin' overtime for the last month
Saturday, call the girls, get 'em gassed up
Gotta hit the club, gotta make that ass jump
Gotta hit the club like you hit them mothafuckin' angles
With your phone out, snappin' like you Fabo
And you showin' off, but it's alright
And you showin' off, but it's alright (Alright!)
It's a short life
Uh-huh! (Oh yeah!)
These hoes! (They mad!)
Your boy! (I had!)
I made! (Watch the breakdown)
Care for me, care for me, you said you'd care for me
There for me, there for me, said you'd be there for me
Cry for me, cry for me, you said you'd die for me
Give to me, give to me, why won't you live for me?
Gotta make that jump, gotta make that, gotta, gotta make that
Gotta make that jump, gotta make that, gotta, gotta make that
Gotta, gotta, gotta g-g-gotta, g-g-gotta, gotta
Gotta, g-g-gotta, gotta, gotta make that jump, jump (Let's go)
Bend it over, lift it up, bend it over, lift it up (Make that jump, jump)
Bend it over, lift it up, bend it over, lift it up (Make that jump, jump)
Bend it over, over, over, over, over, lift it up (Make that jump, jump)
Bend it over, lift it up (Make that jump, jump)
Bend it over, lift it up (Make that jump, jump)
That's a real one in your reflection
Without a follow, without a mention
You really pipin' up on these niggas
You gotta be nice for what to these niggas?
I understand
Care for me, care for me, you said you'd care for me
There for me, there for me, said you'd be there for me
Give to me, give to me, why won't you live for me?
Cry for me, cry for me, you said you'd cry for me
Gotta hit the club like you hit them, hit them, hit them angles
It's a short life, yeah
Cry for me, cry for me, you said you'd die for me
Give to me, give to me, why won't you live for me?"
In My Feelings,"Trap, TrapMoneyBenny
This shit got me in my feelings
Gotta be real with it, yup
Kiki, do you love me? Are you riding?
Say you'll never ever leave from beside me
'Cause I want ya, and I need ya
And I'm down for you always
KB, do you love me? Are you riding?
Say you'll never ever leave from beside me
'Cause I want ya, and I need ya
And I'm down for you always
Look, the new me is really still the real me
I swear you gotta feel me before they try and kill me
They gotta make some choices, they runnin' out of options
'Cause I've been going off and they don't know when it's stopping
And when you get to topping
I see that you've been learning
And when I take you shopping
You spend it like you earned it
And when you popped off on your ex, he deserved it
I thought you were the one from the jump that confirmed it
TrapMoneyBenny
I buy you Champagne but you love some Henny
From the block, like you Jenny
I know you special, girl, 'cause I know too many
'Resha, do you love me? Are you riding?
Say you'll never ever leave from beside me
'Cause I want ya, and I need ya
And I'm down for you always
J.T., do you love me? Are you riding?
Say you'll never ever leave from beside me
'Cause I want ya, and I need ya
And I'm down for you always
Two bad bitches and we kissin' in the Wraith
Kissin'-kissin' in the Wraith, kiss-kissin' in the Wraith
I need that black card and the code to the safe
Code to the safe, code-code to the safe-safe
I show him how that neck work
Fuck that Netflix and chill
What's your net-net-net worth?
'Cause I want ya, and I need ya
And I'm down for you always
(Yea, yea, yea, yea, he bad)
And I'm down for you always
(Yea, yea, yea, guess who's back)
And I'm down for you always
D-down for you al-
(Black biggy biggy black biggy black blake)
D-d-down for you always
(I got a new boy, and that nigga trade!)
Kiki, do you love me? Are you riding?
Say you'll never ever leave from beside me
'Cause I want you, and I need ya
And I'm down for you always
KB, do you love me? Are you riding?
Say you'll never ever leave from beside me
'Cause I want ya, and I
Skate and smoke and ride
Now let me see you
Bring that ass, bring that ass, bring that ass back
Bring that ass, bring that ass, bring that ass back
Now let me see you
Shawty say the nigga that she with can't hit
But shawty, I'ma hit it, hit it like I can't miss
Now let me see you
Walk that ass, you're the only one I love
(Walk that ass, walk-walk that ass)
Now let me see you
Now let me see you
(W-w-walk that ass, you're the only one I love)
Now let me see you, now let me see you
Now let me see you
(Bring that ass back)
Trap, TrapMoneyBenny
This shit got me in my feelings
Gotta be real with it, yup (Now let me see you)
BlaqNmilD, you a genius, you diggin' me?
What are y'all talking about?
You don't know that? I don't even care
I need a photo with Drake
Because my Instagram's weak as fuck
I'm just being real, my shit look"
Yes Indeed,"Yeah
Wheezy outta here
The dash, it's digi', the schedule busy
My head in a hoodie, my shorty a goodie
My cousins are crazy, my cousins like Boogie
Life is amazin', it is what it should be
Been here for ten but I feel like a rookie
I tell her, look up, 'cause it's snowin' in Tootsie's
Booked for three years, man you can't even book me
It's me and Lil' Baby, this shit goin' crazy
Wheezy produced it and Weezy F. made me
And she held it down, so she got a Mercedes
Young Money Records, the Army, the Navy
They ran me ten thousand, I threw it like Brady
The foreign is yellow, like Tracee and K.D
I trusted my niggas, they never betrayed me
Met all these niggas, they sweeter than Sadie
When I started out, I just took what they gave me
Did all the favors, they never repaid me
It worked in my favor, 'cause nobody saved me
Brand new whip, got no keys
Tailor my clothes, no starch please
Soon as I nut, you can gon' leave
Got M's in the bank, like yes, indeed
Cartier glasses, I won't even peek at you
Yellow Ferrari like Pikachu
I got 'em waitin' and watchin' what he gon' do
Tryna peep what I do, tryna steal my moves
Twenty-five hundred for a new pair of tennis shoes
The same price, I could make them youngins come and finish you
Lawyer been chargin', he a Jewish like he voodoo
Real dope boy, hundred thousand in Evisu
Presidential tints slide by, we don't see you
I been gettin' money, I ain't worried 'bout what he do
I'm gettin' money like I'm from the '80s
Me and Drake 'bout to drop man, this shit gon' go crazy
They know I'm the truth, comin' straight from the basement
I'm straight as the street, man I come from the pavement
A million, all hundreds, it make em 'go crazy
Wah-wah-wah, bitch, I'm Lil' Baby
Brand new whip, got no keys
Tailor my clothes, no starch please
Soon as I nut, you can gon' leave
Got M's in the bank, like yes, indeed
Me and my dawg goin' all the way
When you livin' like this, they supposed to hate
Brand new whip, got no keys
Tailor my clothes, no starch please
Soon as I nut, you can gon' leave
Got M's in the bank, like yes, indeed
Me and my dawg goin' all the way
When you livin' like this, they supposed to hate
Wheezy outta here"
Best I Ever Had,"You know, a lot of girls be
Thinkin' my songs are about them, but
This is not to get confused
This one's for you
Baby, you my everything, you all I ever wanted
We could do it real big, bigger than you ever done it
You be up on everything, other hoes ain't never on it
I want this forever, I swear I can spend whatever on it
'Cause she hold me down every time I hit her up
When I get right, I promise that we gon' live it up
She made me beg for it 'til she give it up
And I say the same thing every single time
I say, you the fuckin' best (ayy), you the fuckin' best (ayy)
You the fuckin' best (ayy), you the fuckin' best (ayy)
You the best I ever had (ayy), best I ever had (ayy)
Best I ever had (ayy), best I ever had
I say, you the fuckin'
Know you got a roommate, call me when there's no one there
Put the key under the mat and you know I be over there (yup)
I be over there, shawty, I be over there
I be hittin' all the spots that you ain't even know was there
Ha, and you don't even have to ask twice
You could have my heart or we could share it like the last slice
Always felt like you was so accustomed to the fast life
Have a nigga thinkin' that he met you in a past life
Sweatpants, hair tied, chillin' with no make-up on
That's when you're the prettiest, I hope that you don't take it wrong
You don't even trip when friends say, ""You ain't bringin' Drake along?""
You know that I'm workin', I'll be there soon as I make it home
And she a patient in my waiting room
Never pay attention to the rumors and what they assume
And until them girls prove it
I'm the one that never get confused with
'Cause baby, you my everything, you all I ever wanted
We could do it real big, bigger than you ever done it
You be up on everything, other hoes ain't never on it
I want this forever, I swear I can spend whatever on it
'Cause she hold me down every time I hit her up
When I get right, I promise that we gon' live it up
She made me beg for it 'til she give it up
And I say the same thing every single time
I say, you the fuckin' best (ayy), you the fuckin' best (ayy)
You the fuckin' best (ayy), you the fuckin' best (ayy)
You the best I ever had (ayy), best I ever had (ayy)
Best I ever had (ayy), best I ever had
I say, you the fuckin'
Sex, love, pain, baby, I be on that Tank shit
Buzz so big I could probably sell a blank disc
When my album drop, bitches'll buy it for the picture
And niggas'll buy it too and claim they got it for they sister
Magazine paper, girl, the money ain't the issue
They bring dinner to my room and ask me to initial
She call me the referee 'cause I be so official
My shirt ain't got no stripes, but I can make your pussy whistle
Like the Andy Griffith theme song
And who told you to put them jeans on?
Double cup love, you the one I lean on
Feelin' for a fix, then you should really get your fiend on
Yeah, just know my condo is the crack spot
Every single show, she out there reppin' like a mascot
Get it from the back and make your fuckin' bra strap pop
All up in your slot 'til a nigga hit the jackpot
Baby, you my everything, you all I ever wanted
We could do it real big, bigger than you ever done it
You be up on everything, other hoes ain't never on it
I want this forever, I swear I can spend whatever on it
'Cause she hold me down every time I hit her up
When I get right, I promise that we gon' live it up
She made me beg for it 'til she give it up
And I say the same thing every single time
I say, you the fuckin' best (ayy), you the fuckin' best (ayy)
You the fuckin' best (ayy), you the fuckin' best (ayy)
You the best I ever had (ayy), best I ever had (ayy)
Best I ever had (ayy), best I ever had
I say, you the fuckin' best (ayy), you the fuckin' best (ayy)
You the fuckin' best (ayy), you the fuckin' best (ayy)
You the best I ever had (ayy), best I ever had (ayy)
Best I ever had (ayy), best I ever had
Uh, aw yeah
See, this the type of joint you gotta dedicate to somebody
Just make sure they that special somebody, ha
Young Money
Yeah
Yeah
You know who you are
I got you"
Jumpman,"If Young Metro don't trust you I'm gon' shoot you
Yeah, yeah
Halloween
Taliban, Taliban
I'm gon' shoot you
Yeah
Jumpman, Jumpman, Jumpman, them boys up to something
They just spent like two or three weeks out the country
Them boys up to something, they just not just bluffing
You don't have to call, I hit my dance like Usher, woo
I just found my tempo like I'm DJ Mustard, woo
I hit that Ginobili with my left hand up like woo
Lobster and Céline for all my babies that I miss
Chicken fingers, French fries for them hoes that wanna diss
Jumpman, Jumpman, Jumpman, them boys up to something
Uh, uh, uh, I think I need some Robitussin
Way too many questions, you must think I trust you
You searching for answers, I do not know nothing, woo
I see 'em tweaking, they know something's coming, woo
Jumpman, Jumpman, Jumpman, them boys up to something, woo
Jumpman, Jumpman, Jumpman, fuck was you expecting? Woo
Chi-Town, Chi-Town, Michael Jordan just had text me, woo
Jumpman, Jumpman, Jumpman, Jumpman, Jumpman, Jumpman
I just seen the jet take off, they up to something
Them boys just not bluffing, them boys just not bluffing
Jumpman, Jumpman, Jumpman, them boys up to something
She was tryna join the team I told her wait
Chicken wings and fries, we don't go on dates
Nobu, Nobu, Nobu, Nobu, Nobu, Nobu
I just throwed a private dinner in LA
Trapping is a hobby, that's the way for me
Money coming fast, we never getting sleep
I, I just had to buy another safe
Bentley Spur and Phantom, Jordan fadeaway
Yeah, Jumpman, Jumpman, I don't need no introduction
Jumpman, Jumpman, Metro Boomin on production, wow
Hundred cousins out in Memphis, they so country, wow
Tell her stay the night, valet your car, come fuck me now
Jumpman, Jumpman, live on TNT, I'm flexing, ooh
Jumpman, Jumpman, they gave me my own collection, ooh
Jump when I say jump, girl, can you take direction? Ooh
Mutombo with the bitches, you keep getting rejected, woo
Heard they came through Magic City on a Monday
Heard they had the club wild, it was star studded
A bunch of girls going wild when your chain flooded
And I had 'em like wow, cup dirty
Dopeman, dopeman, dopeman, dopeman, dopeman, dopeman
Money on the counter, choppers on the floor
I just copped that tempo, DJ Mustard, woo
Way too much codeine and Adderall
We just count up paper racks, whoa
I know Imma get my bitch back, whoa
I count all these racks that I have on me now Imma have you like whoa
Chanel N°9, Chanel N°5, well, you got 'em both
Jumpman, Jumpman, Jumpman, them boys up to something
They just spent like two or three weeks out the country
Them boys up to something, they just not just bluffing
Jumpman, Jumpman, Jumpman, them boys up to something"
"Hold On, We're Going Home","I got my eyes on you
You're everything that I see
I want your hot love and emotion endlessly
I can't get over you
You left your mark on me
I want your hot love and emotion endlessly
'Cause you're a good girl and you know it
You act so different around me
'Cause you're a good girl and you know it
I know exactly who you could be
Just hold on we're going home
Just hold on we're going home
It's hard to do these things alone
Just hold on we're going home
I got my eyes on you
You're everything that I see
I want your hot love and emotion endlessly
I can't get over you
You left your mark on me
I want your hot love and emotion endlessly
'Cause you're a good girl and you know it (oh, yeah)
You act so different around me
'Cause you're a good girl and you know it
I know exactly who you could be
So just hold on we're going home (goin' home)
Just hold on we're going home (goin' home)
It's hard to do these things alone (things alone)
Just hold on we're going home
(Goin' home)
You're the girl
You're the one
Gave you every
Thing I loved
I think there's something
(Baby)
I think there's something
(Baby)
You're the girl
You're the one
Gave you every
Thing I loved
I think there's something
(Baby)
I think there's something
(Baby)
'Cause you're a good girl and you know it
You act so different around me
'Cause you're a good girl and you know it
I know exactly who you could be
Just hold on we're going home (goin' home)
Just hold on we're going home (goin' home)
It's hard to do these things alone (things alone)
Just hold on we're going home
(Goin' home)"
