Song Name,Lyrics
Teenage Fever,"Your heart is hard to carry after dark
You're to blame for what we could have been
'Cause look at what we are
Your friends are scared to tell you you're in too far
Funny that it's always been all about you from the start
I met someone new last night and we kicked it
And I'm going back there tonight
And you know what's on my mind, this time
Going back there tonight
And you know what's on my mind so
If you had my love
And I gave you all my trust
Would you comfort me?
And if somehow you knew
That your love would be untrue
Would you lie to me?
If you had my love
And I gave you all my trust
Would you comfort me?
And if somehow you knew
That your love would be untrue
Would you lie to me?
Out of body
That's just how I feel when I'm around you shawty
Last night we didn't say it, but girl we both thought it
Why second guess? I should have stayed
You say the word, I'm on the way
This shit feels like teenage fever
I'm not scared of it, she ain't either
Why second guess? I should have stayed
'Cause you know what's on my mind so
If you had my love
And I gave you all my trust
Would you comfort me?
And if somehow you knew
That your love would be untrue
Would you lie to me?
If you had my love
And I gave you all my trust
Would you comfort me?
And if somehow you knew
That your love would be untrue
Would you lie to me?
Yeah
Slightly, ha, took a left turn there
But very much 6AM
Slightly been awake for 24 hours
So please forgive me
More ideas and stuff coming, yeah
Yeah fam, I'm waffling, but man is tired fam
Jesus Christ"
Nonstop,"Look, I just flipped the switch (flipped, flipped)
I don't know nobody else that's doin' this
Bodies start to drop, ayy, hit the floor
Now they wanna know me since I hit the top, ayy
This a Rollie, not a stopwatch, shit don't ever stop
This the flow that got the block hot, shit got super hot, ayy
Give me my respect, give me my respect
I just took it left like I'm ambidex'
Bitch, I move through London with the euro-step
Got a sneaker deal and I ain't break a sweat
Catch me 'cause I'm goin' outta there, I'm gone
How I go from 6 to 23 like I'm LeBron?
Servin' up a pack, servin' up a pack
Niggas pullin' gimmicks 'cause they scared to rap, ayy
Funny how they shook, ayy, got these niggas shook
Pullin' back the curtain by myself, take a look, ayy
I'm a bar spitta, I'm a hard hitta
Yeah I'm light skinned, but I'm still a dark nigga
I'm a wig splitta, I'm a tall figure
I'm a unforgivin' wild-ass dog nigga
Somethin' wrong with 'em, got 'em all bitter
I'm a bill printer, I'm a grave digger
Yeah, I am what I am
I don't have no time for no misunderstandings again
My head is spinnin', from smokin' the chicken, the bass is kickin'
My head is spinnin', from smokin' the chicken, the bass is kickin'
My head is spinnin', from smokin' the chicken, the bass is kickin'
My head is spinnin'
This a Rollie, not a stopwatch, shit don't ever stop
From smokin' the chicken, the bass is kickin'
My head is spinnin', from smokin' the chicken, the bass is kickin'
My head is spinnin', from smokin' the chicken, the bass is kickin'
My head is spinnin', from smokin' the chicken, the bass is kickin'
My head is
Future took the business and ran it for me
I let Ollie take the owl, told him brand it for me
I get two million a pop and that's standard for me
Like I went blind dog, you gotta hand it to me
(Gotta gimme that shit, dog)
Prayed, then I prayed again (amen, Lord)
Had a moment but it came and went
(They don't love you no more)
You don't wanna play with him (nah, nah, nah)
They'll be mournin' you like 8AM (R.I.P.)
Pinky ring 'til I get a wedding ring (whoa, yeah)
Love my brothers, cut 'em in on anything (big slice)
And you know it's King Slime Drizzy, damn (whoa, yeah)
She just said I'm bae, I hit the thizzle dance (Mac Dre shit)
Either hand is the upper hand (oh yeah, shit)
Got a bubba on my other hand (oh yeah, shit, yeah)
This shit ain't no hunnid bands (nah, nah, nah, nah)
Palace look like Buckingham
Bills so big, I call 'em Williams, for real
Reasons to go crazy, got a trillion for real
They been tryin' me but I'm resilient for real
I can't go in public like civilian for real
And I hardly take offense
Money for revenge, man, that's hardly an expense
Al Haymon checks off of all of my events
I like all the profit, man, I hardly do percents (I don't do that shit)
A big part of me resents
Niggas that I knew from when I started in this shit
They see what I got and, man, it's hard to be content
Fuck what they got goin' on, I gotta represent (ayy)
My head is spinnin', from smokin' the chicken, the bass is kickin'
My head is spinnin', from smokin' the chicken, the bass is kickin'
My head is spinnin', from smokin' the chicken, the bass is kickin'
My head is spinnin'
This a Rollie, not a stopwatch, shit don't ever stop
From smokin' the chicken, the bass is kickin'
My head is spinnin', from smokin' the chicken, the bass is kickin'
My head is spinnin', from smokin' the chicken, the bass is kickin'
My head is spinnin'
This the flow that got the block hot, shit got super hot"
Started From the Bottom,"Started
(Zombie on the track)
Started from the bottom, now we're here
Started from the bottom, now my whole team fuckin' here
Started from the bottom, now we're here
Started from the bottom, now the whole team here, nigga
Started from the bottom, now we're here
Started from the bottom, now my whole team here, nigga
Started from the bottom, now we're here
Started from the bottom, now the whole team fuckin' here
I done kept it real from the jump
Living at my mama house we'd argue every month
Nigga, I was tryna get it on my own
Workin' all night, traffic on the way home
And my uncle calling me like, ""Where ya at?
I gave you the keys told you bring it right back""
Nigga, I just think it's funny how it goes
Now I'm on the road, half a million for a show
And we started from the bottom, now we're here
Started from the bottom, now my whole team fuckin' here
Started from the bottom, now we're here
Started from the bottom, now the whole team here, nigga
Started from the bottom, now we're here
Started from the bottom, now the whole team fuckin' here
Started from the bottom, now we're here
Started from the bottom, now the whole team here, nigga
Boys tell stories 'bout the man
Say I never struggled, wasn't hungry, yeah, I doubt it, nigga
I could turn your boy into the man
There ain't really much I hear that's poppin' off without us, nigga
We just want the credit where it's due
I'ma worry 'bout me, give a fuck about you
Nigga, just as a reminder to myself
I wear every single chain, even when I'm in the house
'Cause we started from the bottom, now we're here
Started from the bottom, now my whole team fuckin' here
Started from the bottom, now we're here
Started from the bottom, now the whole team here, nigga
No new niggas, nigga we don't feel that
Fuck a fake friend, where your real friends at?
We don't like to do too much explainin'
Story stay the same, I never changed it
No new niggas, nigga we don't feel that
Fuck a fake friend, where your real friends at?
We don't like to do too much explainin'
Story stay the same through the money and the fame
'Cause we started from the bottom, now we're here
Started from the bottom, now my whole team fuckin' here
Started from the bottom, now we're here
Started from the bottom, now the whole team here, nigga
Started from the bottom, now we're here
Started from the bottom, now my whole team here, nigga
Started from the bottom, now we're here
Started from the bottom, now the whole team here, nigga"
Yebba’s Heartbreak,"How much better can I show my love for you
Than say ""I do, I do, I do""?
I do, I do, I do
You may not know right where you're going, but
I do, I do, I do
And all the times you wasn't chosen, well, I'll make it up to you
All of the feelings you're not showing
When your river's overflowing, mmm
It's the truth, swear to you
I do, I do, I do, I do, I do
And all that you are, I do
My single line of stars in noon
Reflection of the very moon, I do
I do, I do, I do
Show my love for you
Can I show my love for you?
(Can I show my love for you?)"
MIA (feat. Drake),"Bad Bunny, baby, bebé
Yeh-yeh-yeh-yeh
Yeah
Todos están pendiente' a ti (wuh)
Pero tú puesta pa' mí (ajá)
Haciendo que me odien más (yeh-yeh-yeh)
Porque todos te quieren probar (ah)
Lo que no saben es que no te dejas llevar de cualquiera
Y todos te quieren probar (ah)
Lo que no saben es que hoy yo te voy a buscar (yeh-yeh; ¡rrrra!)
Dile que tú eres mía, mía
Tú sabe' que eres mía, mía
Tú misma lo decías
Cuando yo te lo hacía
Yeh, dile que tú eres mía, mía
Tú sabe' que eres mía, mía
Tú misma lo decías
Cuando yo te lo hacía
Yeh-yeh-yeh-yeh
Bebé, yo soy fan de tu caminar
Te doy todo lo mío, hasta mi respirar (yeh)
Contigo veo todo como en espiral (yeh)
Quiero tirarnos fotos y que se hagan viral (ah)
Tus ojos me concentran como Adderall (wuh)
Contigo me subes al overall (yeh)
Te toco y hasta el mundo deja de girar (wuh)
A nosotros ni la muerte nos va a separar (nah)
Bebé, yo soy tuyo na' má' (na' má')
Diles que conmigo te vas (wuh)
Que dejen de tirarte (prrr)
Que a ti nadie va a tocarte
Dile que tú eres mía, mía
Tú sabes que eres mía, mía
Tú misma lo decías (tú misma lo decías)
Cuando yo te lo hacía (cuando yo te lo hacía)
Yeh, dile que tú eres mía, mía
Tú sabe' que eres mía, mía
Tú misma lo decías (tú misma lo decías)
Cuando yo te lo hacía (cuando yo te lo hacía)
Yo soy tu Romeo, pero no santo (no)
A estos bobos con la forty los espanto (¡plo-plo!)
Muchas me quieren desde que yo canto (ah)
Pero yo soy tuyo na' má' (wuh)
Yo soy tu Romeo, pero no santo (yeh)
A estos bobos con la forty los espanto (¡rrra!)
Muchas me quieren desde que yo canto (ajá)
Pero yo soy tuyo na' má'
Dile que tú eres mía desde la high (desde la high; yeh)
El yerno favorito de tu mai (de tu mai)
El capo que tenía to' las Jordan y las Nike (Jordan y las nike
Dile a estos bobos que dejen de darte like (de darte like)
Quiero está noche entera
Pa' recordar los tiempos en la escalera (la escalera)
Dile que yo no soy cualquiera
Yo soy tu primero, tú eres mi primera, yah-yah
Porque todos te quieren probar (ajá)
Lo que no saben es que no te dejas llevar de cualquiera
Y todos te quieren probar (wuh)
Lo que no saben es que hoy yo te voy a buscar, yeh-yeh (¡rrra!)
Dile que tú eres mía, mía
Tú sabe' que eres mía, mía
Tú misma lo decías (tú misma lo decías)
Cuando yo te lo hacía (cuando yo te lo hacía)
Dile que tú eres mía, mía
Tú sabe' que eres mía, mía
Tú misma lo decías (tú misma lo decías)
Cuando yo te lo hacía (cuando yo te lo hacía)"
Hotline Bling,"You used to call me on my
You used to, you used to
Yeah
You used to call me on my cell phone
Late night when you need my love
Call me on my cell phone
Late night when you need my love
And I know when that hotline bling
That can only mean one thing
I know when that hotline bling
That can only mean one thing
Ever since I left the city, you
Got a reputation for yourself now
Everybody knows and I feel left out
Girl you got me down, you got me stressed out
Cause ever since I left the city, you
Started wearing less and goin' out more
Glasses of champagne out on the dance floor
Hangin' with some girls I've never seen before
You used to call me on my cell phone
Late night when you need my love
Call me on my cell phone
Late night when you need my love
I know when that hotline bling
That can only mean one thing
I know when that hotline bling
That can only mean one thing
Ever since I left the city, you, you, you
You and me, we just don't get along
You make me feel like I did you wrong
Going places where you don't belong
Ever since I left the city, you
You got exactly what you asked for
Running out of pages in your passport
Hanging with some girls I've never seen before
You used to call me on my cell phone
Late night when you need my love
Call me on my cell phone
Late night when you need my love
And I know when that hotline bling
That can only mean one thing
I know when that hotline bling
That can only mean one thing
These days, all I do is
Wonder if you're bendin' over backwards for someone else
Wonder if you're rolling up a Backwoods for someone else
Doing things I taught you, gettin' nasty for someone else
You don't need no one else
You don't need nobody else, no
Why you never alone
Why you always touching road
Used to always stay at home, be a good girl
You was in the zone, yeah
You should just be yourself
Right now, you're someone else
You used to call me on my cell phone
Late night when you need my love
Call me on my cell phone
Late night when you need my love
And I know when that hotline bling
That can only mean one thing
I know when that hotline bling
That can only mean one thing
Ever since I left the city..."
Fake Love,"Yeah
Yeah
I've been down so long it look like up to me
They look up to me
I got fake people showin' fake love to me
Straight up to my face, straight up to my face
I've been down so long it look like up to me
They look up to me
I got fake people showin' fake love to me
Straight up to my face, straight up to my face
Somethin' ain't right when we talkin'
Somethin' ain't right when we talkin'
Look like you hidin' your problems
Really you never was solid
No you can't son me, you won't ever get to run me
Just when shit look, outta reach, I reach back like one, three
Like one, three, yeah
That's when they smile in my face
Whole time they wanna take my place
Whole time they wanna take my place
Whole time they wanna take my place
Yeah, I know they wanna take my place
I can tell that love is fake
I don't trust a word you say
How you wanna click up after your mistakes?
Look you in the face and it's just not the same
I've been down so long it look like up to me
They look up to me
I got fake people showin' fake love to me
Straight up to my face, straight up to my face
I've been down so long it look like up to me
They look up to me
I got fake people showin' fake love to me
Straight up to my face, straight up to my face
Yeah, straight up to my face, tryna play it safe
Vibe switch like night and day, I can see ya like right away
I came up, you changed up, I caught that whole play
Since then, it's never been the same
That's when they smile in my face
Whole time they wanna take my place
Whole time they wanna take my place
Whole time they wanna take my place
Yeah, I know they wanna take my place
I can tell that love is fake
(I can tell that love is fake)
I don't trust a word you say
(I don't trust a word)
How you wanna click up after your mistakes?
(That's just what I heard)
Look you in the face and it's just not the same
I've been down so long it look like up to me
They look up to me
I got fake people showin' fake love to me
Straight up to my face, straight up to my face
I've been down so long it look like up to me
They look up to me
I got fake people showin' fake love to me
Straight up to my face, straight up to my face (skrrt)"
Poetic Justice,"Every second, every minute, man I swear that she can get it
Say if you a bad bitch put your hands up high, hands up high, hands up high
Tell 'em dim the lights down right now, put me in the mood
I'm talking 'bout dark room, perfume
Go, go
I recognize your fragrance (hol' up)
You ain't never gotta say shit (woo)
And I know your taste is
A little bit (mmm) high maintenance (ooh)
Everybody else basic
You live life on an everyday basis
With poetic justice, poetic justice
If I told you that a flower bloomed in a dark room, would you trust it?
I mean I write poems in these songs dedicated to you
When you're in the mood for empathy, there's blood in my pen
Better yet where your friends and them?
I really wanna know you all
I really wanna show you off
Fuck that, pour up plenty of champagne
Cold nights when you curse this name
You called up your girlfriends and
Y'all curled in that little bitty Range I heard that
She wanna go and party, she wanna go and party
Nigga don't approach her with that Atari
Nigga that ain't good game, homie, sorry
They say conversation, rule a nation, I can tell
But I could never right my wrongs
'Less I write it down for real, P.S
You can get it, you can get it
You can get it, you can get it
And I know just, know just, know just, know just, know just what you want
Poetic justice, put it in a song
You can get it, you can get it
You can get it, you can get it
And I know just, know just, know just, know just, know just what you want
Poetic justice, put it in a song
I really hope you play this
'Cause ol' girl you test my patience
With all these seductive photographs and all these one off vacations
You've been taken
Clearly a lot for me to take in
It don't make sense
Young East African Girl, you too busy fucking with your other man
I was trying to put you on game, put you on a plane
Take you and your mama to the motherland
I could do it, maybe one day
When you figure out you're gonna need someone
When you figure out it's all right here in the city
And you don't run from where we come from
That sound like poetic justice, poetic justice
You were so new to this life but God damn you got adjusted
I mean I write poems in these songs, dedicated to the fun sex
Your natural hair and your soft skin, and your big ass in that sundress (ooh)
Good God, what you doing that walk for?
When I see that thing move, I just wish we would fight less
And we would talk more
And they say communication save relations, I can tell
But I can never right my wrongs unless I write them down for real
P.S
You can get it, you can get it
You can get it, you can get it
And I know just, know just, know just, know just, know just what you want
Poetic justice, put it in a song
Every time I write these words they become a taboo
Making sure my punctuation curve, every letter here's true
Living my life in the margin and that metaphor was proof
I'm talking poetic justice, poetic justice
If I told you that a flower bloomed in a dark room, would you trust it?
I mean you need to hear this
Love is not just a verb, it's you looking in the mirror
Love is not just a verb, it's you looking for a maybe
Call me crazy, we can both be insane
A fatal attraction is common
And what we have common is pain
I mean you need to hear this
Love is not just a verb and I can see power steering
Sex drive when you swerve, I want that interference
It's coherent, I can hear it, mmhm
That's your heartbeat
It either caught me or it called me, mmhm
Breathe slow and you'll find gold mines in these lines
Sincerely, yours truly
And right before you go blind
P.S
You can get it, you can get it
You can get it, you can get it
And I know just, know just, know just, know just, know just what you want
Poetic justice, put it in a song
I'm gon' ask you one more time, homie
Where is you from? Or it is a problem (ask him if he here for Sherane)
Ayy, you over here for Sherane, homie?
I don't care who this nigga over here for
If he don't tell me where he from, it's a wrap I'm sorry
Hol' up, hol' up, hol' up, we gon' do it like this, okay?
I'ma tell you where I'm from, okay?
You gon' tell me where you from, okay?
Or where your grandma stay, where your mama stay
Or where your daddy stay, okay? Fuck with all this talkin'
As a matter of fact, get out the van, homie
Get out the car before I snatch you out that motherfucker, homie"
Pipe Down,"Said you belong to the streets but the streets belong to me
It's like home to me (she belongs to the streets)
It's like home to me
I tatted your passport up
Now it's lookin' like a arm sleeve
Just know that was all me
And when you see Chanel, I wish that's how you saw me
That shit you tell Chanel, I wish that's how you called me
That raw shit, that honesty, yeah
You know I love you more than all them niggas put together
And it's a lot of niggas' trust, I put the list together
And it's a lot just to assume we're meant to be together
You gotta live that shit for real, you can't just say whatever
You could never tell nobody that you held me down
If it was ride or die then you should've been dead right now
So I don't get how you're yelling at me
How much I gotta spend for you to pipe down? (Pipe down)
How deep I gotta dig for you to pipe down? (Pipe down)
All the things I've done up until right now (right now)
I need a thousand pages just to write it down (write it down)
Writing down these feelings, it's been overdue (overdue)
Don't know how many pens it's gonna take to get over you
How much I gotta pen for you to pipe down? (Pipe down)
How deep I gotta dig for you to pipe down?
Tried to run it back a hundred times
The world is yours, but the city's mine
I can't believe you put it on your mother's life
I can't believe you told me it was ride or die
'Cause you're not here, somehow you're still alive
True enough I know you're from the other side
I set my expectations way too high
Yeah, and I would listen to the lies that you would tell all night
Angel eyes, but you've been giving me hell all night
I know the book that you would write is a tell-some, not a tell-all
Just to make sure you well off, you would sell all rights
Why does your ex think we beefin', is that man alright?
That nigga can't even look at me, he fell off twice
And I'm back poppin', I still remember the day I saw you
I was on your ass like back pockets
Niggas love to hate, but what is that stopping?
So much shit I wanted to say, straight to your face
But you're so two-faced, that I don't know which face
You're the reason we'll be going separate ways
You're the reason we cannot communicate
It's not the things you say, it's what you don't say
I'm not in your way, you're in your own way
So I don't get how you're yelling at me
How much I gotta spend for you to pipe down? (Pipe down)
How deep I gotta dig for you to pipe down? (Pipe down)
All the things I've done up until right now (right now)
I need a thousand pages just to write it down (write it down)
Writing down these feelings, it's been overdue (overdue)
Don't know how many pens it's gonna take to get over you
How much I gotta pen for you to pipe down? (Pipe down)
How deep I gotta dig for you to pipe down?
Baby, pipe down
Ooh, ooh, ooh"
Omertà,"Look at my history
I'm tryna see what's different from that guy and the richer me
The only thing I see is custom owls from Tiffany
And some gunnas that'll hit you outta nowhere like epiphany
Really, that's it to me
Aside from the obvious, man, it changes in scenery
Testin' me gon' have my niggas testin' machinery
They say that they happy, my man, that's not how they seem to be
The boy, he wild and peaceful, rest in peace Teena Marie
Ethics and values, mob traditions, old fashioned
Monopoly action
Bronny buyin' up Brentwood like he still in Akron
A lot of pain, a lot of passion
A lot of relaxin' while other niggas is overreactin'
That's how we continue down the path of Jordan and Jackson
That's some insight for y'all even if no one's askin'
Last year, niggas really feel like they rode on me
Last year, niggas got hot 'cause they told on me
I'm 'bout to call the bluff of anybody that fold on me
I'm buyin' the buildin' of every door that closed on me
Yeah, Loro Piana and Brioni, the one and only
Champagne popper, the love doctor
Your baby mother call me when she lonely
My tailor see me twice a week, he like my homie
Forever grateful, forever thankful
Diamond necklace, but she wears it on her ankle
The bitch is trendy
My enemies send each other the texts that they could never send me
I'm bankin' two million a show for the residency
Nevada gaming commission in a frenzy
How much money can this casino lend me?
Rippin' markers up over shots of the Henny
Vivid memory, can someone send me a real nigga interlude?
To me, Benihana is pigeon food
This not a forgivin' mood
So much, we gotta count the twenties up in a different room
I am just a body that my brothers are livin' through
Keepin' my connections strictly physical
Everyone that's married is miserable
I know that that is not a lifestyle I can give into
The rise to the top of this mountain has been biblical
I don't carry cash 'cause the money is digital
It's the American Expresser, the debt collector
Hailin' all the way from the Mecca
Got something for Trudy and Rebecca
This shit could last forever
The mind controller, the Ayatollah
I built a bridge to success and had visions of me ridin' over
Step in the room and October gets a lot closer
Haunted houses
I don't know how to count in thousands, only millions
Now tell your friends I'm not the villain
Send 'em to Lagos or Turks and Caicos
Barbados, Trinidad and Tobago
Never go the same places they go
Separate vacations
A far cry from when Drizzy had slept in the basement
I was never on the path to get into Cambridge
I mean, I was good at doin' math, but I'm better with language
Borderline dangerous, approach with caution
I plan to buy your most personal belongings when they up for auction
Man, truth be told, I think about it often
The petty king, the overseer of many things
I wish that I was playin' in a sport where we were gettin' rings
I wouldn't have space on either hand for anything
West Hollywood, know my presence is menacing
Cosa Nostra, shady dealings
Racketeering, the syndicate got they hand in plenty things
The things that we've done to protect the name are unsettling
But no regrets, though, the name'll echo
Years later, none greater
Death to a coward and a traitor, that's just in my nature, yeah"
